{
  "templateName": "Location General Computer Services",
  "description": "General computer service FAQ templates for location-specific pages",
  "variables": ["[location]", "[Location]"],
  "baseFAQs": [
    {
      "question": "What computer services do you offer in [location]?",
      "answer": "We provide comprehensive computer services in [location] including virus removal, password reset, computer optimization, software installation, and emergency troubleshooting for both Windows and Mac computers.",
      "category": "service",
      "priority": 9
    },
    {
      "question": "How quickly can you arrive for computer service in [location]?",
      "answer": "We typically arrive within 30 minutes for computer service calls in [location]. Our mobile technicians know the area well and can quickly reach all neighborhoods in [location].",
      "category": "service",
      "priority": 8
    },
    {
      "question": "Do you service both Windows and Mac computers in [location]?",
      "answer": "Yes, our [location] technicians are certified to work on both Windows PCs and Mac computers. We handle all operating system issues, software problems, and optimization needs for both platforms.",
      "category": "device",
      "priority": 7
    },
    {
      "question": "What areas of [location] do you serve?",
      "answer": "We provide mobile computer service throughout [location] and surrounding neighborhoods. Our service area covers all major districts and residential areas within [location].",
      "category": "service",
      "priority": 6
    },
    {
      "question": "How much does computer service cost in [location]?",
      "answer": "Our [location] computer service pricing is competitive and transparent. We provide upfront quotes with no hidden fees. Contact us at (402) 416-6942 for specific pricing based on your computer issue.",
      "category": "booking",
      "priority": 5
    },
    {
      "question": "Do you offer emergency computer service in [location]?",
      "answer": "Yes, we offer same-day emergency computer service throughout [location]. Whether you have a critical work presentation or urgent deadline, we prioritize emergency calls with rapid response times.",
      "category": "booking",
      "priority": 8
    },
    {
      "question": "Can you remove viruses from my computer in [location]?",
      "answer": "Absolutely! Virus removal is one of our most requested services in [location]. We thoroughly scan, remove malware, and install protection to prevent future infections on your computer.",
      "category": "service",
      "priority": 7
    },
    {
      "question": "Do you provide computer service for businesses in [location]?",
      "answer": "Yes, we serve many [location] businesses and offer corporate accounts with priority service and volume discounts for companies. We understand business downtime costs money.",
      "category": "service",
      "priority": 6
    }
  ],
  "customization": {
    "allowAdditions": true,
    "allowRemoval": false,
    "maxFAQs": 15,
    "minFAQs": 5
  }
}